TABREF KURSUS,Update: 16/01/2023,Unnamed: 2,Unnamed: 3,Unnamed: 4,Unnamed: 5,Unnamed: 6,Unnamed: 7,Unnamed: 8
,,,,,,,,
JENIS_KURSUS_ID,CEPAT_KODE,NAMA,,META DATA,,,,
A5EB03E201F8F6A0E040640A040252AD,2001,ADMINISTRASI KEUANGAN DAERAH,,Name,Null?,Type,Parameter,Keterangan
A5EB03E201F9F6A0E040640A040252AD,2002,ADMINISTRASI PERKANTORAN,,ID,NOT NULL,VARCHAR2(2),,ID yang otomatis ter-generate saat data dibuat
A5EB03E201FAF6A0E040640A040252AD,2003,AIR LIMBAH,,JENIS_KURSUS_SERTIPIKAT,NOT NULL,VARCHAR2(100),,Nama Kursus
A5EB03E201FBF6A0E040640A040252AD,2004,ALIH TEKNOLOGI,,,,,,
A5EB03E201FCF6A0E040640A040252AD,2005,AMDAL A DAN B,,,,,,
A5EB03E201FDF6A0E040640A040252AD,2006,ANALISA STATISTIK/DEMOGRAFI,,,,,,
A5EB03E201FEF6A0E040640A040252AD,2007,ANALISIS JABATAN,,,,,,
A5EB03E201FFF6A0E040640A040252AD,2008,ANIMAL NATION,,,,,,
A5EB03E20200F6A0E040640A040252AD,2009,APLIKASI KEPEGAWAIAN,,,,,,
A5EB03E20201F6A0E040640A040252AD,2010,ARGONOMI,,,,,,
A5EB03E20202F6A0E040640A040252AD,2011,ASPAL BUTAS,,,,,,
A5EB03E20203F6A0E040640A040252AD,2012,ASPAL HOTMIX,,,,,,
A5EB03E20204F6A0E040640A040252AD,2013,ATR,,,,,,
A5EB03E20205F6A0E040640A040252AD,2014,BAHASA DAERAH,,,,,,
A5EB03E201F6F6A0E040640A040252AD,2875,BAHASA INGGRIS,,,,,,
A5EB03E20206F6A0E040640A040252AD,2015,BALI GETTLE BREADING PROGRAM,,,,,,
A5EB03E20207F6A0E040640A040252AD,2016,BENDAHARAWAN B,,,,,,
A5EB03E20208F6A0E040640A040252AD,2017,BENDAHARAWAN BARANG,,,,,,
A5EB03E20209F6A0E040640A040252AD,2018,BENDAHARAWAN PROYEK IPJK/IBRD,,,,,,
A5EB03E2020CF6A0E040640A040252AD,2021,BID. PENYEHATAN PEMUKIMAN LING,,,,,,
A5EB03E2020AF6A0E040640A040252AD,2019,BIDANG PEMUKIMAN,,,,,,
A5EB03E2020BF6A0E040640A040252AD,2020,BIDANG PERSAMPAHAN,,,,,,
A5EB03E2020DF6A0E040640A040252AD,2022,BIMB. EKONOMI PERTANIAN,,,,,,
A5EB03E2020EF6A0E040640A040252AD,2023,BIMB. MASYARAKAT PROG.PERBAIKAN KAMPUNG,,,,,,
A5EB03E2020FF6A0E040640A040252AD,2024,BIMB. PERENCANAAN TENAGA KERJA DAERAH,,,,,,
A5EB03E20212F6A0E040640A040252AD,2027,BIMB. TEHNIS PENYELESAIAN HUKUM,,,,,,
A5EB03E20211F6A0E040640A040252AD,2026,BIMB. TEKNIK PEMBANGUNAN,,,,,,
A5EB03E20210F6A0E040640A040252AD,2025,BIMB. TEKNIS MASALAH SOSPOL,,,,,,
D834501E63B03A8CE050640AF10824F4,3138,BIMTEK MEDIA SOSIAL,,,,,,
D834501E63A93A8CE050640AF10824F4,3131,BIMTEK PENGEMBANGAN SERTIFIKASI (BNSP),,,,,,
D834501E63C23A8CE050640AF10824F4,3156,BIMTEK PENYUSUNAN PR,,,,,,
D834501E63B13A8CE050640AF10824F4,3139,BIMTEK PRODUSER TV/PRODUSER,,,,,,
A5EB03E20213F6A0E040640A040252AD,2028,BINA MUTU PERIKANAN,,,,,,
A5EB03E20214F6A0E040640A040252AD,2029,BINA WISATA,,,,,,
A5EB03E20215F6A0E040640A040252AD,2030,BKP,,,,,,
A5EB03E20216F6A0E040640A040252AD,2031,BRIDGE ENGINER ENG COURSE,,,,,,
A5EB03E20217F6A0E040640A040252AD,2032,"BUDIDAYA PADI,PALAWIJA,HORTIKULTURA",,,,,,
A5EB03E20218F6A0E040640A040252AD,2033,BUDIDAYA TANAMAN HIAS,,,,,,
A5EB03E20219F6A0E040640A040252AD,2034,CALON PENYULUH P2DT,,,,,,
A5EB03E2021AF6A0E040640A040252AD,2035,COACHING KEUANGAN DAN BENDAHARAWAN,,,,,,
A5EB03E2021BF6A0E040640A040252AD,2036,CONTRUKTION MANAJEMEN COURSE IN JAPAN,,,,,,
A5EB03E2021CF6A0E040640A040252AD,2037,CROPING SISTEM,,,,,,
A5EB03E2049FF6A0E040640A040252AD,2598,DAL HAMA ORYETES SP SECARA BIOLOGIS,,,,,,
A5EB03E2021DF6A0E040640A040252AD,2038,DEMOGRAFI,,,,,,
A5EB03E2021EF6A0E040640A040252AD,2039,DIARE,,,,,,
D834501E63AD3A8CE050640AF10824F4,3135,DIKAT PERENCANAAN ANGGARAN,,,,,,
A5EB03E20234F6A0E040640A040252AD,2061,DIKL PENINGK.TRAMP.TEK.KERAJINAN PERKOP.,,,,,,
D834501E63AB3A8CE050640AF10824F4,3133,DIKLAT ACCOUNT EXECUTIVE,,,,,,
A5EB03E2022BF6A0E040640A040252AD,2052,DIKLAT ADMINISTRASI KESOSIALAN,,,,,,
A5EB03E2021FF6A0E040640A040252AD,2040,DIKLAT APARATUR TEKNIS FUNGSIONAL,,,,,,
A5EB03E20220F6A0E040640A040252AD,2041,DIKLAT BINA MARGA,,,,,,
D834501E63B73A8CE050640AF10824F4,3145,DIKLAT DASAR KAMERAMEN,,,,,,
A5EB03E2022CF6A0E040640A040252AD,2053,DIKLAT DASAR KLH,,,,,,
D834501E63B23A8CE050640AF10824F4,3140,DIKLAT DRONE,,,,,,
D834501E63AE3A8CE050640AF10824F4,3136,DIKLAT DVBT2,,,,,,
8B91B70E3B7F12E5E050640A29034DA5,2907,DIKLAT FUNGSIONAL ADMINISTRATOR DATABASE KEPENDUDUKAN,,,,,,
8B91B70E3BAC12E5E050640A29034DA5,2952,DIKLAT FUNGSIONAL ADMINISTRATOR KESEHATAN,,,,,,
8B91B70E3C0012E5E050640A29034DA5,3036,DIKLAT FUNGSIONAL AGEN,,,,,,
8B91B70E3C0D12E5E050640A29034DA5,3049,DIKLAT FUNGSIONAL ANALIS APBN,,,,,,
D38B303C229D0BACE050640AF1087680,3130,DIKLAT FUNGSIONAL ANALIS HUKUM,,,,,,
8B91B70E3BFD12E5E050640A29034DA5,3033,DIKLAT FUNGSIONAL ANALIS KEBIJAKAN,,,,,,
8B91B70E3BFA12E5E050640A29034DA5,3030,DIKLAT FUNGSIONAL ANALIS KEPEGAWAIAN,,,,,,
8B91B70E3B9212E5E050640A29034DA5,2926,DIKLAT FUNGSIONAL ANALIS KETAHANAN PANGAN,,,,,,
8B91B70E3B9312E5E050640A29034DA5,2927,DIKLAT FUNGSIONAL ANALIS PERKARANTINAAN TUMBUHAN,,,,,,
8B91B70E3BA312E5E050640A29034DA5,2943,DIKLAT FUNGSIONAL ANALIS PERTAHANAN NEGARA,,,,,,
8B91B70E3C1012E5E050640A29034DA5,3052,DIKLAT FUNGSIONAL ANALIS TRANSAKSI KEUANGAN,,,,,,
8B91B70E3B7312E5E050640A29034DA5,2895,DIKLAT FUNGSIONAL ANALISIS ANGGARAN,,,,,,
8B91B70E3B6A12E5E050640A29034DA5,2886,DIKLAT FUNGSIONAL ANALISIS KEIMIGRASIAN,,,,,,
8B91B70E3B7412E5E050640A29034DA5,2896,DIKLAT FUNGSIONAL ANALISIS KEUANGAN PUSAT DAN DAERAH,,,,,,
8B91B70E3BDD12E5E050640A29034DA5,3001,DIKLAT FUNGSIONAL ANALISIS PASAR HASIL PERIKANAN,,,,,,
8B91B70E3B8812E5E050640A29034DA5,2916,DIKLAT FUNGSIONAL ANALISIS PASAR HASIL PERTANIAN,,,,,,
8B91B70E3BAD12E5E050640A29034DA5,2953,DIKLAT FUNGSIONAL APOTEKER,,,,,,
8B91B70E3C0712E5E050640A29034DA5,3043,DIKLAT FUNGSIONAL ARSIPARIS,,,,,,
8B91B70E3B8712E5E050640A29034DA5,2915,DIKLAT FUNGSIONAL ASESOR MANAJEMEN MUTU INDUSTRI,,,,,,
8B91B70E3B6B12E5E050640A29034DA5,2887,DIKLAT FUNGSIONAL ASISTEM PEMBIMBING KEMASYARAKATAN,,,,,,
8B91B70E3BAE12E5E050640A29034DA5,2954,DIKLAT FUNGSIONAL ASISTEN APOTEKER,,,,,,
8B91B70E3BE212E5E050640A29034DA5,3006,DIKLAT FUNGSIONAL ASISTEN INSPEKTUR MUTU HASIL PERIKANAN,,,,,,
8B91B70E3BEF12E5E050640A29034DA5,3019,DIKLAT FUNGSIONAL ASISTEN PELATIH OLAHRAGA,,,,,,
8B91B70E3BE312E5E050640A29034DA5,3007,DIKLAT FUNGSIONAL ASISTEN PEMBINA MUTU HASIL KELAUTAN DAN PERIKANAN,,,,,,
8B91B70E3BC812E5E050640A29034DA5,2980,DIKLAT FUNGSIONAL ASISTEN PENATA ANESTESI,,,,,,
8B91B70E3BDF12E5E050640A29034DA5,3003,DIKLAT FUNGSIONAL ASISTEN PENGELOLA PRODUKSI PERIKANAN TANGKAP,,,,,,
8B91B70E3BEC12E5E050640A29034DA5,3016,DIKLAT FUNGSIONAL ASISTEN PENGUJI PERANGKAT TELEKOMUNIKASI,,,,,,
8B91B70E3B7B12E5E050640A29034DA5,2903,DIKLAT FUNGSIONAL ASISTEN PENILAI PAJAK,,,,,,
8B91B70E3C0F12E5E050640A29034DA5,3051,DIKLAT FUNGSIONAL ASISTEN PERISALAH LEGISLATIF,,,,,,
8B91B70E3BE612E5E050640A29034DA5,3010,DIKLAT FUNGSIONAL ASISTEN PRANATA SIARAN,,,,,,
8B91B70E3BE712E5E050640A29034DA5,3011,DIKLAT FUNGSIONAL ASISTEN TEKNISI SIARAN,,,,,,
8B91B70E3BFB12E5E050640A29034DA5,3031,DIKLAT FUNGSIONAL ASSESSOR SDM APARATUR,,,,,,
8B91B70E3BF712E5E050640A29034DA5,3027,DIKLAT FUNGSIONAL AUDITOR,,,,,,
8B91B70E3BFC12E5E050640A29034DA5,3032,DIKLAT FUNGSIONAL AUDITOR KEPEGAWAIAN,,,,,,
8B91B70E3BAF12E5E050640A29034DA5,2955,DIKLAT FUNGSIONAL BIDAN,,,,,,
8B8231F908BC414AE050640A2903466B,2880,DIKLAT FUNGSIONAL DIPLOMAT,,,,,,
8B91B70E3BB012E5E050640A29034DA5,2956,DIKLAT FUNGSIONAL DOKTER,,,,,,
8B91B70E3BB112E5E050640A29034DA5,2957,DIKLAT FUNGSIONAL DOKTER GIGI,,,,,,
8B91B70E3B9512E5E050640A29034DA5,2929,DIKLAT FUNGSIONAL DOKTER HEWAN KARANTINA,,,,,,
8B91B70E3BB212E5E050640A29034DA5,2958,DIKLAT FUNGSIONAL DOKTER PENDIDIK KLINIS,,,,,,
8B91B70E3BAB12E5E050640A29034DA5,2951,DIKLAT FUNGSIONAL DOSEN,,,,,,
8B91B70E3BB412E5E050640A29034DA5,2960,DIKLAT FUNGSIONAL ENTOMOLOG KESEHATAN,,,,,,
8B91B70E3BB312E5E050640A29034DA5,2959,DIKLAT FUNGSIONAL EPIDEMIOLOG KESEHATAN,,,,,,
8B91B70E3BB612E5E050640A29034DA5,2962,DIKLAT FUNGSIONAL FISIKAWAN MEDIS,,,,,,
8B91B70E3BB512E5E050640A29034DA5,2961,DIKLAT FUNGSIONAL FISIOTERAPIS,,,,,,
8B91B70E3BA412E5E050640A29034DA5,2944,DIKLAT FUNGSIONAL GURU,,,,,,
8B91B70E3B9712E5E050640A29034DA5,2931,DIKLAT FUNGSIONAL INSPEKTUR KETENAGALISTRIKAN,,,,,,
8B91B70E3B9812E5E050640A29034DA5,2932,DIKLAT FUNGSIONAL INSPEKTUR MINYAK DAN GAS BUMI,,,,,,
8B91B70E3BE412E5E050640A29034DA5,3008,DIKLAT FUNGSIONAL INSPEKTUR MUTU HASIL PERIKANAN,,,,,,
8B91B70E3B9912E5E050640A29034DA5,2933,DIKLAT FUNGSIONAL INSPEKTUR TAMBANG,,,,,,
8B91B70E3BCC12E5E050640A29034DA5,2984,DIKLAT FUNGSIONAL INSTRUKTUR,,,,,,
8B91B70E3BF012E5E050640A29034DA5,3020,DIKLAT FUNGSIONAL JAKSA,,,,,,
8B91B70E3BA212E5E050640A29034DA5,2942,DIKLAT FUNGSIONAL KATALOGER,,,,,,
8B91B70E3BCF12E5E050640A29034DA5,2987,DIKLAT FUNGSIONAL MEDIATOR HUBUNGAN INDUSTRIAL,,,,,,
8B91B70E3B8912E5E050640A29034DA5,2917,DIKLAT FUNGSIONAL MEDIK VETERINER,,,,,,
8B91B70E3BB712E5E050640A29034DA5,2963,DIKLAT FUNGSIONAL NUTRISIONIS,,,,,,
8B91B70E3BB812E5E050640A29034DA5,2964,DIKLAT FUNGSIONAL OKUPASI TERAPIS,,,,,,
8B91B70E3B8012E5E050640A29034DA5,2908,DIKLAT FUNGSIONAL OPERATOR SIAK,,,,,,
8B91B70E3BF112E5E050640A29034DA5,3021,DIKLAT FUNGSIONAL OPERATOR TRANSMISI SANDI,,,,,,
8B91B70E3BB912E5E050640A29034DA5,2965,DIKLAT FUNGSIONAL ORTHOTIS PROSTETIS,,,,,,
8B91B70E3BA512E5E050640A29034DA5,2945,DIKLAT FUNGSIONAL PAMONG BELAJAR,,,,,,
8B91B70E3BA612E5E050640A29034DA5,2946,DIKLAT FUNGSIONAL PAMONG BUDAYA,,,,,,
8B91B70E3B9612E5E050640A29034DA5,2930,DIKLAT FUNGSIONAL PARAMEDIK KARANTINA HEWAN,,,,,,
8B91B70E3B8A12E5E050640A29034DA5,2918,DIKLAT FUNGSIONAL PARAMEDIK VETERINER,,,,,,
8B91B70E3BD212E5E050640A29034DA5,2990,DIKLAT FUNGSIONAL PEKERJA SOSIAL,,,,,,
8B91B70E3BEE12E5E050640A29034DA5,3018,DIKLAT FUNGSIONAL PELATIH OLAHRAGA,,,,,,
8B91B70E3B7512E5E050640A29034DA5,2897,DIKLAT FUNGSIONAL PELELANG,,,,,,
8B91B70E3B6C12E5E050640A29034DA5,2888,DIKLAT FUNGSIONAL PEMBIMBING KEMASYARAKATAN,,,,,,
8B91B70E3BBA12E5E050640A29034DA5,2966,DIKLAT FUNGSIONAL PEMBIMBING KESEHATAN KERJA,,,,,,
8B91B70E3BA112E5E050640A29034DA5,2941,DIKLAT FUNGSIONAL PEMBINA JASA KONSTRUKSI,,,,,,
8B91B70E3BE512E5E050640A29034DA5,3009,DIKLAT FUNGSIONAL PEMBINA MUTU HASIL KELAUTAN DAN PERIKANAN,,,,,,
8B91B70E3C0812E5E050640A29034DA5,3044,DIKLAT FUNGSIONAL PEMERIKSA,,,,,,
8B91B70E3B7612E5E050640A29034DA5,2898,DIKLAT FUNGSIONAL PEMERIKSA BEA DAN CUKAI,,,,,,
8B91B70E3B7112E5E050640A29034DA5,2893,DIKLAT FUNGSIONAL PEMERIKSA DESAIN INDUSTRI,,,,,,
8B91B70E3B9412E5E050640A29034DA5,2928,DIKLAT FUNGSIONAL PEMERIKSA KARANTINA TUMBUHAN,,,,,,
8B91B70E3B6D12E5E050640A29034DA5,2889,DIKLAT FUNGSIONAL PEMERIKSA KEIMIGRASIAN,,,,,,
8B91B70E3B6E12E5E050640A29034DA5,2890,DIKLAT FUNGSIONAL PEMERIKSA MEREK,,,,,,
8B91B70E3B7712E5E050640A29034DA5,2899,DIKLAT FUNGSIONAL PEMERIKSA PAJAK,,,,,,
8B91B70E3B6F12E5E050640A29034DA5,2891,DIKLAT FUNGSIONAL PEMERIKSA PATEN,,,,,,
8B91B70E3B9112E5E050640A29034DA5,2925,DIKLAT FUNGSIONAL PEMERIKSA PVT,,,,,,
8B91B70E3BC912E5E050640A29034DA5,2981,DIKLAT FUNGSIONAL PENATA ANESTESI,,,,,,
8B91B70E3B6512E5E050640A29034DA5,2881,DIKLAT FUNGSIONAL PENATA KONSELERAI,,,,,,
8B91B70E3B7C12E5E050640A29034DA5,2904,DIKLAT FUNGSIONAL PENATA LAKSANA BARANG,,,,,,
8B91B70E3B9C12E5E050640A29034DA5,2936,DIKLAT FUNGSIONAL PENATA RUANG,,,,,,
8B91B70E3BFF12E5E050640A29034DA5,3035,DIKLAT FUNGSIONAL PENELITI,,,,,,
8B91B70E3B8112E5E050640A29034DA5,2909,DIKLAT FUNGSIONAL PENERA,,,,,,
8B91B70E3BD412E5E050640A29034DA5,2992,DIKLAT FUNGSIONAL PENERJEMAH,,,,,,
8B91B70E3B9A12E5E050640A29034DA5,2934,DIKLAT FUNGSIONAL PENGAMAT GUNUNG API,,,,,,
8B91B70E3C0212E5E050640A29034DA5,3038,DIKLAT FUNGSIONAL PENGAMAT METEREOLOGI DAN GEOFISIKA,,,,,,
8B91B70E3B8312E5E050640A29034DA5,2911,DIKLAT FUNGSIONAL PENGAMAT TERA,,,,,,
8B91B70E3BCD12E5E050640A29034DA5,2985,DIKLAT FUNGSIONAL PENGANTAR KERJA,,,,,,
8B91B70E3B8B12E5E050640A29034DA5,2919,DIKLAT FUNGSIONAL PENGAWAS BENIH TANAMAN,,,,,,
8B91B70E3B8C12E5E050640A29034DA5,2920,DIKLAT FUNGSIONAL PENGAWAS BIBIT TERNAK,,,,,,
8B91B70E3C0312E5E050640A29034DA5,3039,DIKLAT FUNGSIONAL PENGAWAS FARMASI DAN MAKANAN,,,,,,
8B91B70E3B8412E5E050640A29034DA5,2912,DIKLAT FUNGSIONAL PENGAWAS KEMETROLOGIAN,,,,,,
8B91B70E3B6712E5E050640A29034DA5,2883,DIKLAT FUNGSIONAL PENGAWAS KESELAMATAN PELAYARAN,,,,,,
8B91B70E3BCE12E5E050640A29034DA5,2986,DIKLAT FUNGSIONAL PENGAWAS KETENAGAKERJAAN,,,,,,
8B91B70E3BD912E5E050640A29034DA5,2997,DIKLAT FUNGSIONAL PENGAWAS LINGKUNGAN HIDUP,,,,,,
8B91B70E3B8D12E5E050640A29034DA5,2921,DIKLAT FUNGSIONAL PENGAWAS MUTU HASIL PANGAN,,,,,,
8B91B70E3B8E12E5E050640A29034DA5,2922,DIKLAT FUNGSIONAL PENGAWAS MUTU PAKAN,,,,,,
8B91B70E3B7D12E5E050640A29034DA5,2905,DIKLAT FUNGSIONAL PENGAWAS PENYELENGGARAAN URUSAN PEMERINTAHAN DI DAERAH (PENGAWAS PEMERINTAHAN),,,,,,
8B91B70E3BDA12E5E050640A29034DA5,2998,DIKLAT FUNGSIONAL PENGAWAS PERIKANAN,,,,,,
8B91B70E3BF912E5E050640A29034DA5,3029,DIKLAT FUNGSIONAL PENGAWAS RADIASI,,,,,,
8B91B70E3BA712E5E050640A29034DA5,2947,DIKLAT FUNGSIONAL PENGAWAS SEKOLAH,,,,,,
8B91B70E3BDE12E5E050640A29034DA5,3002,DIKLAT FUNGSIONAL PENGELOLA EKOSISTEM LAUT DAN PESISIR,,,,,,
8B91B70E3BE112E5E050640A29034DA5,3005,DIKLAT FUNGSIONAL PENGELOLA KESEHATAN IKAN,,,,,,
8B91B70E3C0912E5E050640A29034DA5,3045,DIKLAT FUNGSIONAL PENGELOLA PENGADAAN BARANG/JASA,,,,,,
8B91B70E3BE012E5E050640A29034DA5,3004,DIKLAT FUNGSIONAL PENGELOLA PRODUKSI PERIKANAN TANGKAP,,,,,,
8B91B70E3BA912E5E050640A29034DA5,2949,DIKLAT FUNGSIONAL PENGEMBANG TEKNOLOGI PEMBELAJARAN,,,,,,
8B91B70E3BD812E5E050640A29034DA5,2996,DIKLAT FUNGSIONAL PENGENDALI DAMPAK LINGKUNGAN,,,,,,
8B91B70E3BD512E5E050640A29034DA5,2993,DIKLAT FUNGSIONAL PENGENDALI EKOSISTEM HUKUM,,,,,,
DFCEE247A4A19AF2E050640AF10829CF,3158,DIKLAT FUNGSIONAL PENGENDALI EKOSISTEM HUTAN,,,,,,
8B91B70E3BEA12E5E050640A29034DA5,3014,DIKLAT FUNGSIONAL PENGENDALI FREKUENSI RADIO,,,,,,
8B91B70E3BDB12E5E050640A29034DA5,2999,DIKLAT FUNGSIONAL PENGENDALI HAMA DAN PENYAKIT IKAN,,,,,,
8B91B70E3B8F12E5E050640A29034DA5,2923,DIKLAT FUNGSIONAL PENGENDALI OPT,,,,,,
8B91B70E3BD112E5E050640A29034DA5,2989,DIKLAT FUNGSIONAL PENGGERAK SWADAYA MASYARAKAT,,,,,,
8B91B70E3BCA12E5E050640A29034DA5,2982,DIKLAT FUNGSIONAL PENGHULU,,,,,,
8B91B70E3B6812E5E050640A29034DA5,2884,DIKLAT FUNGSIONAL PENGUJI KENDARAAN BERMOTOR,,,,,,
8B91B70E3BD012E5E050640A29034DA5,2988,DIKLAT FUNGSIONAL PENGUJI KESELAMATAN DAN KESEHATAN KERJA (PENGUJI K3),,,,,,
8B91B70E3B8212E5E050640A29034DA5,2910,DIKLAT FUNGSIONAL PENGUJI MUTU BARANG,,,,,,
8B91B70E3BED12E5E050640A29034DA5,3017,DIKLAT FUNGSIONAL PENGUJI PERANGKAT TELEKOMUNIKASI,,,,,,
8B91B70E3B7A12E5E050640A29034DA5,2902,DIKLAT FUNGSIONAL PENILAI PAJAK,,,,,,
8B91B70E3B7812E5E050640A29034DA5,2900,DIKLAT FUNGSIONAL PENILAI PEMERINTAH,,,,,,
8B91B70E3BA812E5E050640A29034DA5,2948,DIKLAT FUNGSIONAL PENILIK,,,,,,
8B91B70E3B9B12E5E050640A29034DA5,2935,DIKLAT FUNGSIONAL PENYELIDIK BUMI,,,,,,
8B91B70E3C0C12E5E050640A29034DA5,3048,DIKLAT FUNGSIONAL PENYIDIK BNN,,,,,,
8B91B70E3BCB12E5E050640A29034DA5,2983,DIKLAT FUNGSIONAL PENYULUH AGAMA,,,,,,
8B91B70E3B7212E5E050640A29034DA5,2894,DIKLAT FUNGSIONAL PENYULUH HUKUM,,,,,,
8B91B70E3BD612E5E050640A29034DA5,2994,DIKLAT FUNGSIONAL PENYULUH KEHUTANAN,,,,,,
8B91B70E3BF412E5E050640A29034DA5,3024,DIKLAT FUNGSIONAL PENYULUH KELUARGA BERENCANA,,,,,,
8B91B70E3BBB12E5E050640A29034DA5,2967,DIKLAT FUNGSIONAL PENYULUH KESEHATAN MASYARAKAT,,,,,,
8B91B70E3C0B12E5E050640A29034DA5,3047,DIKLAT FUNGSIONAL PENYULUH NARKOBA,,,,,,
8B91B70E3B7912E5E050640A29034DA5,2901,DIKLAT FUNGSIONAL PENYULUH PAJAK,,,,,,
8B91B70E3BDC12E5E050640A29034DA5,3000,DIKLAT FUNGSIONAL PENYULUH PERIKANAN,,,,,,
8B91B70E3B8612E5E050640A29034DA5,2914,DIKLAT FUNGSIONAL PENYULUH PERINDUSTRIAN DAN PERDAGANGAN,,,,,,
8B91B70E3B9012E5E050640A29034DA5,2924,DIKLAT FUNGSIONAL PENYULUH PERTANIAN,,,,,,
8B91B70E3BD312E5E050640A29034DA5,2991,DIKLAT FUNGSIONAL PENYULUH SOSIAL,,,,,,
8B91B70E3B7012E5E050640A29034DA5,2892,DIKLAT FUNGSIONAL PERANCANG PERATURAN PERUNDANG-UNDANGAN,,,,,,
8B91B70E3BBC12E5E050640A29034DA5,2968,DIKLAT FUNGSIONAL PERAWAT,,,,,,
8B91B70E3BBD12E5E050640A29034DA5,2969,DIKLAT FUNGSIONAL PERAWAT GIGI,,,,,,
8B91B70E3BBE12E5E050640A29034DA5,2970,DIKLAT FUNGSIONAL PEREKAM MEDIS,,,,,,
8B91B70E3BF512E5E050640A29034DA5,3025,DIKLAT FUNGSIONAL PEREKAYASA,,,,,,
8B91B70E3C0612E5E050640A29034DA5,3042,DIKLAT FUNGSIONAL PERENCANA,,,,,,
8B91B70E3C0E12E5E050640A29034DA5,3050,DIKLAT FUNGSIONAL PERISALAH LEGISLATIF,,,,,,
8B91B70E3BD712E5E050640A29034DA5,2995,DIKLAT FUNGSIONAL POLISI KEHUTANAN,,,,,,
8B91B70E3B7E12E5E050640A29034DA5,2906,DIKLAT FUNGSIONAL POLISI PAMONG PRAJA (POL PP),,,,,,
8B91B70E3BE912E5E050640A29034DA5,3013,DIKLAT FUNGSIONAL PRANATA HUBUNGAN MASYARAKAT,,,,,,
8B91B70E3B6612E5E050640A29034DA5,2882,DIKLAT FUNGSIONAL PRANATA INFORMASI DIPLOMATIK,,,,,,
8B91B70E3C0412E5E050640A29034DA5,3040,DIKLAT FUNGSIONAL PRANATA KOMPUTER,,,,,,
8B91B70E3B8512E5E050640A29034DA5,2913,DIKLAT FUNGSIONAL PRANATA LABORATORIUM KEMETROLOGIAN,,,,,,
8B91B70E3BBF12E5E050640A29034DA5,2971,DIKLAT FUNGSIONAL PRANATA LABORATORIUM KESEHATAN,,,,,,
8B91B70E3BAA12E5E050640A29034DA5,2950,DIKLAT FUNGSIONAL PRANATA LABORATORIUM PENDIDIKAN,,,,,,
8B91B70E3C0112E5E050640A29034DA5,3037,DIKLAT FUNGSIONAL PRANATA NUKLIR,,,,,,
8B91B70E3BE812E5E050640A29034DA5,3012,DIKLAT FUNGSIONAL PRANATA SIARAN,,,,,,
8B91B70E3BC012E5E050640A29034DA5,2972,DIKLAT FUNGSIONAL PSIKOLOG KLINIS,,,,,,
8B91B70E3BF812E5E050640A29034DA5,3028,DIKLAT FUNGSIONAL PUSTAKAWAN,,,,,,
8B91B70E3BC112E5E050640A29034DA5,2973,DIKLAT FUNGSIONAL RADIOGRAFER,,,,,,
8B91B70E3BC212E5E050640A29034DA5,2974,DIKLAT FUNGSIONAL REFRAKSIONIS OPTISIEN,,,,,,
8B91B70E3C0A12E5E050640A29034DA5,3046,DIKLAT FUNGSIONAL RESCUER,,,,,,
8B91B70E3BF212E5E050640A29034DA5,3022,DIKLAT FUNGSIONAL SANDIMAN,,,,,,
8B91B70E3BC312E5E050640A29034DA5,2975,DIKLAT FUNGSIONAL SANITARIAN,,,,,,
8B91B70E3C0512E5E050640A29034DA5,3041,DIKLAT FUNGSIONAL STATISTISI,,,,,,
8B91B70E3BF312E5E050640A29034DA5,3023,DIKLAT FUNGSIONAL SURVEYOR PEMETAAN,,,,,,
8B91B70E3B9D12E5E050640A29034DA5,2937,DIKLAT FUNGSIONAL TEKNIK JALAN DAN JEMBATAN,,,,,,
8B91B70E3B9E12E5E050640A29034DA5,2938,DIKLAT FUNGSIONAL TEKNIK PENGAIRAN,,,,,,
8B91B70E3BA012E5E050640A29034DA5,2940,DIKLAT FUNGSIONAL TEKNIK PENYEHATAN LINGKUNGAN,,,,,,
8B91B70E3B9F12E5E050640A29034DA5,2939,DIKLAT FUNGSIONAL TEKNIK TATA BANGUNAN DAN PERUMAHAN,,,,,,
8B91B70E3BC412E5E050640A29034DA5,2976,DIKLAT FUNGSIONAL TEKNISI ELEKTROMEDIS,,,,,,
8B91B70E3BC512E5E050640A29034DA5,2977,DIKLAT FUNGSIONAL TEKNISI GIGI,,,,,,
8B91B70E3BF612E5E050640A29034DA5,3026,DIKLAT FUNGSIONAL TEKNISI PENELITIAN DAN PEREKAYASAAN,,,,,,
8B91B70E3B6912E5E050640A29034DA5,2885,DIKLAT FUNGSIONAL TEKNISI PENERBANGAN,,,,,,
8B91B70E3BEB12E5E050640A29034DA5,3015,DIKLAT FUNGSIONAL TEKNISI SIARAN,,,,,,
8B91B70E3BC612E5E050640A29034DA5,2978,DIKLAT FUNGSIONAL TEKNISI TRANSFUSI DARAH,,,,,,
8B91B70E3BC712E5E050640A29034DA5,2979,DIKLAT FUNGSIONAL TERAPIS WICARA,,,,,,
8B91B70E3BFE12E5E050640A29034DA5,3034,DIKLAT FUNGSIONAL WIDYAISWARA,,,,,,
D834501E63B63A8CE050640AF10824F4,3144,DIKLAT HUMAS,,,,,,
D834501E63AC3A8CE050640AF10824F4,3134,DIKLAT INFORMATION COMMUNICATION TECHNOLOGY,,,,,,
A5EB03E2022DF6A0E040640A040252AD,2054,DIKLAT KADER PEMBIBITAN UDANG,,,,,,
A5EB03E2022EF6A0E040640A040252AD,2055,DIKLAT KEPEMIMPINAN SERIKAT BURUH,,,,,,
A5EB03E2022FF6A0E040640A040252AD,2056,DIKLAT KEPENDUDUKAN,,,,,,
A5EB03E20230F6A0E040640A040252AD,2057,DIKLAT LANJUTAN PETUGAS OPERATOR,,,,,,
A5EB03E20221F6A0E040640A040252AD,2042,DIKLAT LLD/PKB,,,,,,
A5EB03E20222F6A0E040640A040252AD,2043,DIKLAT MANTRI HEWAN,,,,,,
A5EB03E20223F6A0E040640A040252AD,2044,DIKLAT MASTER OF CEREMONY (MC),,,,,,
A5EB03E20224F6A0E040640A040252AD,2045,DIKLAT MONITORING & PELAPORAN PEMBANG.,,,,,,
D834501E63BB3A8CE050640AF10824F4,3149,DIKLAT MULTICAMERA MUSIK,,,,,,
D834501E63C03A8CE050640AF10824F4,3154,DIKLAT MULTIPLEXING,,,,,,
D834501E63B53A8CE050640AF10824F4,3143,DIKLAT OPERATOR AC NIELSON,,,,,,
A5EB03E20231F6A0E040640A040252AD,2058,DIKLAT OPERATOR KOMPUTER,,,,,,
A5EB03E20225F6A0E040640A040252AD,2046,DIKLAT PENANGGULANGAN BAHAYA KEBAKARAN,,,,,,
D834501E63B93A8CE050640AF10824F4,3147,DIKLAT PENDAHULUAN JURNALISTIK TV,,,,,,
D834501E63B83A8CE050640AF10824F4,3146,DIKLAT PENDAHULUAN PRODUKSI,,,,,,
D834501E63BA3A8CE050640AF10824F4,3148,DIKLAT PENDAHULUAN TOS (TEKNIK OPERASIONAL STUDIO),,,,,,
A5EB03E20232F6A0E040640A040252AD,2059,DIKLAT PENGAMANAN KESEHATAN HAJI,,,,,,
A5EB03E20233F6A0E040640A040252AD,2060,DIKLAT PENILAIAN HARTA TETAP,,,,,,
A5EB03E20236F6A0E040640A040252AD,2063,DIKLAT PENYULUH PERIKANAN TK.II,,,,,,
A5EB03E20235F6A0E040640A040252AD,2062,DIKLAT PENYULUH PERTANIAN/PERIKANAN,,,,,,
E67F0157EEBFEB31E050640AF10844ED,3159,DIKLAT PENYUSUNAN KURIKULUM,,,,,,
E67F0157EEC0EB31E050640AF10844ED,3160,DIKLAT PENYUSUNAN MODUL,,,,,,
A5EB03E20226F6A0E040640A040252AD,2047,DIKLAT PERPUSTAKAAN KELILING,,,,,,
A5EB03E20227F6A0E040640A040252AD,2048,DIKLAT PROYEK MANAGEMENT SISTEM,,,,,,
D834501E63AF3A8CE050640AF10824F4,3137,DIKLAT REPORTER OLAHRAGA,,,,,,
A5EB03E20237F6A0E040640A040252AD,2064,DIKLAT SANDI,,,,,,
A5EB03E20238F6A0E040640A040252AD,2065,DIKLAT SJDI,,,,,,
A5EB03E20228F6A0E040640A040252AD,2049,DIKLAT TEK. & MANAG. PERENC. PEMBANG.,,,,,,
CEB02F55C44C5BA2E050640AF1085889,3078,DIKLAT TEKNIS ANALIS ANGGARAN,,,,,,
CEB02F55C45C5BA2E050640AF1085889,3094,DIKLAT TEKNIS ANALIS HUKUM,,,,,,
CEB02F55C4545BA2E050640AF1085889,3086,DIKLAT TEKNIS ANALIS KEBIJAKAN,,,,,,
CF556584FA51276BE050640AF108582B,3119,DIKLAT TEKNIS ANALIS KETATALAKSANAAN,,,,,,
CF556584FA52276BE050640AF108582B,3120,DIKLAT TEKNIS ANALIS SDM APARATUR,,,,,,
CEB02F55C44D5BA2E050640AF1085889,3079,DIKLAT TEKNIS ARSIPARIS,,,,,,
CEB02F55C4515BA2E050640AF1085889,3083,DIKLAT TEKNIS ASESOR SDM,,,,,,
CF556584FA53276BE050640AF108582B,3121,DIKLAT TEKNIS ASESOR SDM APARATUR,,,,,,
CF556584FA54276BE050640AF108582B,3122,DIKLAT TEKNIS AUDITOR,,,,,,
CEB02F55C44F5BA2E050640AF1085889,3081,DIKLAT TEKNIS AUDITOR,,,,,,
CEB02F55C45D5BA2E050640AF1085889,3095,DIKLAT TEKNIS PELAKSANA,,,,,,
CEB02F55C4535BA2E050640AF1085889,3085,DIKLAT TEKNIS PENATA LAKSANA BARANG,,,,,,
CF556584FA55276BE050640AF108582B,3123,DIKLAT TEKNIS PENELAAH HUKUM,,,,,,
CEB02F55C4495BA2E050640AF1085889,3075,DIKLAT TEKNIS PENGAWAS FARMASI DAN MAKANAN,,,,,,
CF556584FA56276BE050640AF108582B,3124,DIKLAT TEKNIS PENGELOLA BARANG MILIK NEGARA,,,,,,
CEB02F55C44A5BA2E050640AF1085889,3076,DIKLAT TEKNIS PENGELOLA KEUANGAN APBN,,,,,,
CEB02F55C44B5BA2E050640AF1085889,3077,DIKLAT TEKNIS PENGELOLA PENGADAAN BARANG DAN JASA,,,,,,
CEB02F55C4525BA2E050640AF1085889,3084,DIKLAT TEKNIS PENGELOLA SDM APARATUR,,,,,,
CEB02F55C4555BA2E050640AF1085889,3087,DIKLAT TEKNIS PENGEMBANGAN TEKNOLOGI PEMBELAJARAN,,,,,,
CEB02F55C44E5BA2E050640AF1085889,3080,DIKLAT TEKNIS PERANCANG UNDANG-UNDANG,,,,,,
CEB02F55C4575BA2E050640AF1085889,3089,DIKLAT TEKNIS PERENCANA,,,,,,
CEB02F55C4565BA2E050640AF1085889,3088,DIKLAT TEKNIS PRANATA HUMAS,,,,,,
CEB02F55C4505BA2E050640AF1085889,3082,DIKLAT TEKNIS PRANATA KOMPUTER,,,,,,
CF556584FA58276BE050640AF108582B,3126,DIKLAT TEKNIS PRANATA SDM APARATUR,,,,,,
D8BE940B5EAB87A4E050640AF1080D2C,3157,DIKLAT TEKNIS PRANATA SIARAN,,,,,,
CEB02F55C4585BA2E050640AF1085889,3090,DIKLAT TEKNIS PSIKOLOGI KLINIS,,,,,,
CEB02F55C4595BA2E050640AF1085889,3091,DIKLAT TEKNIS PUSTAKAWAN,,,,,,
CF556584FA59276BE050640AF108582B,3127,DIKLAT TEKNIS SEKRETARIS,,,,,,
CEB02F55C45A5BA2E050640AF1085889,3092,DIKLAT TEKNIS STATISTISI,,,,,,
CEB02F55C45E5BA2E050640AF1085889,3096,DIKLAT TEKNIS STRUKTURAL,,,,,,
D07CD28E524AC8B3E050640AF1084D6F,3129,DIKLAT TEKNIS TELEKOMUNIKASI,,,,,,
CF556584FA5A276BE050640AF108582B,3128,DIKLAT TEKNIS VERIFIKATUR KEUANGAN,,,,,,
CEB02F55C45B5BA2E050640AF1085889,3093,DIKLAT TEKNIS WIDYAISWARA,,,,,,
A5EB03E20239F6A0E040640A040252AD,2066,DIKLAT TEKNOLOGI PERIKANAN AIR PAYAU,,,,,,
A5EB03E2023AF6A0E040640A040252AD,2067,DIKLAT TEKNOLOGI PERIKANAN AIR TAWAR,,,,,,
A5EB03E20229F6A0E040640A040252AD,2050,DIKLAT TENAGA PENELITI,,,,,,
A5EB03E2023BF6A0E040640A040252AD,2068,DIKLAT TENAGA SOSIAL,,,,,,
A5EB03E2022AF6A0E040640A040252AD,2051,DIKLAT TERNAK BABI,,,,,,
D834501E63AA3A8CE050640AF10824F4,3132,DIKLAT TRAINING OF TRAINER,,,,,,
D834501E63B33A8CE050640AF10824F4,3141,DIKLAT UMUM VIDEO EDITOR (ONLINE - PERHUBUNGAN),,,,,,
A5EB03E2023CF6A0E040640A040252AD,2069,DRAINASE JALAN,,,,,,
A5EB03E2023DF6A0E040640A040252AD,2070,EKONOMI PERTANIAN,,,,,,
D834501E63B43A8CE050640AF10824F4,3142,ELECTRICAL GROUNDING,,,,,,
A5EB03E2023EF6A0E040640A040252AD,2071,ENGINE/MESIN,,,,,,
A5EB03E2023FF6A0E040640A040252AD,2072,FORUM KONST. BIDANG PENANAMAN MODAL,,,,,,
A5EB03E20240F6A0E040640A040252AD,2073,FRAMBUSIA,,,,,,
A5EB03E20241F6A0E040640A040252AD,2074,FUNGSI ADMINISTRASI,,,,,,
A5EB03E20432F6A0E040640A040252AD,2759,GAS PENYULUHAN BIN TERPADU DESA TERPADU,,,,,,
A5EB03E20242F6A0E040640A040252AD,2075,GAS REGISTER,,,,,,
A5EB03E20243F6A0E040640A040252AD,2076,GENERAL GUIDE,,,,,,
A5EB03E20244F6A0E040640A040252AD,2077,HAMA DAN PENYAKIT,,,,,,
A5EB03E20245F6A0E040640A040252AD,2078,HANDLUS SEMEN,,,,,,
A5EB03E20246F6A0E040640A040252AD,2079,HIJAUAN MAKANAN TERNAK,,,,,,
A5EB03E20247F6A0E040640A040252AD,2080,HIMPUNAN PETUGAS PETERNAK SAPI PERAH,,,,,,
A5EB03E20248F6A0E040640A040252AD,2081,HMT/KONSENTRAT,,,,,,
A5EB03E20249F6A0E040640A040252AD,2082,HUMAS INDUSTRI,,,,,,
A5EB03E2024BF6A0E040640A040252AD,2084,IB. (KETRAMPILAN KAWIN SUNTIK),,,,,,
A5EB03E2024AF6A0E040640A040252AD,2083,IBEC,,,,,,
E67F0157EEC1EB31E050640AF10844ED,3161,IDEOLOGI PANCASILA,,,,,,
A5EB03E2024CF6A0E040640A040252AD,2085,INDUCTION TRAIN. BI&G TNMN KOPI & KELAPA,,,,,,
A5EB03E2024DF6A0E040640A040252AD,2086,INPACT POIN SUB SEKTOR PETERNAKAN,,,,,,
A5EB03E2024EF6A0E040640A040252AD,2087,INSEMINATOR,,,,,,
A5EB03E20254F6A0E040640A040252AD,2093,INSEMINATOR STERILISASI KEBIDANAN,,,,,,
A5EB03E2024FF6A0E040640A040252AD,2088,INSERI IUD,,,,,,
A5EB03E20250F6A0E040640A040252AD,2089,INSERVE TRAINING KEPALA SD,,,,,,
A5EB03E20251F6A0E040640A040252AD,2090,INSTRUKTUR CIPTA KARYA,,,,,,
A5EB03E20252F6A0E040640A040252AD,2091,INTEG.ASPEK KEPEND.DLM PERENC.PEMBANG.,,,,,,
A5EB03E20253F6A0E040640A040252AD,2092,IPTEK,,,,,,
A5EB03E20255F6A0E040640A040252AD,2094,JOB TRAINING ADMINISTRASI KEPENDUDUKAN,,,,,,
A5EB03E20257F6A0E040640A040252AD,2096,JOB TRAINING CATATAN SIPIL,,,,,,
A5EB03E20256F6A0E040640A040252AD,2095,JOB TRAINING PETUGAS PERPUSTAKAAN,,,,,,
A5EB03E20258F6A0E040640A040252AD,2097,JURU PENGAIRAN,,,,,,
A5EB03E20259F6A0E040640A040252AD,2098,JURU PERIKSA DAGING,,,,,,
